Title,Lifetime Gross,Year,Title,Year,Rated,Released,Runtime,Genre,Director,Writer,Actors,Plot,Language,Country,Awards,Ratings,Metascore,imdbRating,imdbVotes,DVD,BoxOffice
Toy Story 4,1073841394,2019,Toy Story 4,2019,G,21 Jun 2019,100 min,"Animation, Adventure, Comedy",Josh Cooley,"John Lasseter, Andrew Stanton, Josh Cooley","Tom Hanks, Tim Allen, Annie Potts","When a new toy called ""Forky"" joins Woody and the gang, a road trip alongside old and new friends reveals how big the world can be for a toy.",English,United States,Won 1 Oscar. 60 wins & 66 nominations total,"[{'Source': 'Internet Movie Database', 'Value': '7.7/10'}, {'Source': 'Rotten Tomatoes', 'Value': '97%'}, {'Source': 'Metacritic', 'Value': '84/100'}]",84,7.7,"280,163",01 Oct 2019,"$434,038,008"
Toy Story 3,1067316101,2010,Toy Story 3,2010,G,18 Jun 2010,103 min,"Animation, Adventure, Comedy",Lee Unkrich,"John Lasseter, Andrew Stanton, Lee Unkrich","Tom Hanks, Tim Allen, Joan Cusack","The toys are mistakenly delivered to a day-care center instead of the attic right before Andy leaves for college, and it's up to Woody to convince the other toys that they weren't abandoned and to return home.","English, Spanish",United States,Won 2 Oscars. 63 wins & 96 nominations total,"[{'Source': 'Internet Movie Database', 'Value': '8.3/10'}, {'Source': 'Rotten Tomatoes', 'Value': '98%'}, {'Source': 'Metacritic', 'Value': '92/100'}]",92,8.3,"892,138",01 Jan 2014,"$415,004,880"
Pirates of the Caribbean: Dead Man's Chest,1066179747,2006,Pirates of the Caribbean: Dead Man's Chest,2006,PG-13,07 Jul 2006,151 min,"Action, Adventure, Fantasy",Gore Verbinski,"Ted Elliott, Terry Rossio, Stuart Beattie","Johnny Depp, Orlando Bloom, Keira Knightley","Jack Sparrow races to recover the heart of Davy Jones to avoid enslaving his soul to Jones' service, as other friends and foes seek the heart for their own agenda as well.","English, Turkish, Greek, Mandarin, French",United States,Won 1 Oscar. 45 wins & 54 nominations total,"[{'Source': 'Internet Movie Database', 'Value': '7.4/10'}, {'Source': 'Rotten Tomatoes', 'Value': '53%'}, {'Source': 'Metacritic', 'Value': '53/100'}]",53,7.4,"766,538",01 Jan 2014,"$423,315,812"
Rogue One: A Star Wars Story,1058684742,2016,Rogue One: A Star Wars Story,2016,PG-13,16 Dec 2016,133 min,"Action, Adventure, Sci-Fi",Gareth Edwards,"Chris Weitz, Tony Gilroy, John Knoll","Felicity Jones, Diego Luna, Alan Tudyk","In a time of conflict, a group of unlikely heroes band together on a mission to steal the plans to the Death Star, the Empire's ultimate weapon of destruction.",English,United States,Nominated for 2 Oscars. 24 wins & 85 nominations total,"[{'Source': 'Internet Movie Database', 'Value': '7.8/10'}, {'Source': 'Rotten Tomatoes', 'Value': '84%'}, {'Source': 'Metacritic', 'Value': '65/100'}]",65,7.8,"686,179",24 Mar 2017,"$533,539,991"
Aladdin,1054304000,2019,Aladdin,1992,G,25 Nov 1992,90 min,"Animation, Adventure, Comedy","Ron Clements, John Musker","Ron Clements, John Musker, Ted Elliott","Scott Weinger, Robin Williams, Linda Larkin",A kind-hearted street urchin and a power-hungry Grand Vizier vie for a magic lamp that has the power to make their deepest wishes come true.,English,"United States, Japan",Won 2 Oscars. 35 wins & 22 nominations total,"[{'Source': 'Internet Movie Database', 'Value': '8.0/10'}, {'Source': 'Rotten Tomatoes', 'Value': '95%'}, {'Source': 'Metacritic', 'Value': '86/100'}]",86,8.0,"466,563",01 Sep 2016,"$217,350,219"
Pirates of the Caribbean: On Stranger Tides,1046721266,2011,Pirates of the Caribbean: On Stranger Tides,2011,PG-13,20 May 2011,136 min,"Action, Adventure, Fantasy",Rob Marshall,"Ted Elliott, Terry Rossio, Stuart Beattie","Johnny Depp, Penélope Cruz, Ian McShane","Jack Sparrow and Barbossa embark on a quest to find the elusive fountain of youth, only to discover that Blackbeard and his daughter are after it too.","English, Spanish","United States, United Kingdom",3 wins & 31 nominations,"[{'Source': 'Internet Movie Database', 'Value': '6.6/10'}, {'Source': 'Rotten Tomatoes', 'Value': '33%'}, {'Source': 'Metacritic', 'Value': '45/100'}]",45,6.6,"560,613",01 Jan 2014,"$241,071,802"
Despicable Me 3,1034800131,2017,Despicable Me 3,2017,PG,30 Jun 2017,89 min,"Animation, Adventure, Comedy","Kyle Balda, Pierre Coffin, Eric Guillon","Cinco Paul, Ken Daurio","Steve Carell, Kristen Wiig, Trey Parker","Gru meets his long-lost, charming, cheerful, and more successful twin brother Dru, who wants to team up with him for one last criminal heist.",English,"United States, France, Japan",33 nominations,"[{'Source': 'Internet Movie Database', 'Value': '6.2/10'}, {'Source': 'Rotten Tomatoes', 'Value': '59%'}, {'Source': 'Metacritic', 'Value': '49/100'}]",49,6.2,"153,925",10 Jul 2017,"$264,624,300"
Finding Dory,1029266989,2016,Finding Dory,2016,PG,17 Jun 2016,97 min,"Animation, Adventure, Comedy","Andrew Stanton, Angus MacLane","Andrew Stanton, Victoria Strouse","Ellen DeGeneres, Albert Brooks, Ed O'Neill",Friendly but forgetful blue tang Dory begins a search for her long-lost parents and everyone learns a few things about the real meaning of family along the way.,"English, Indonesian","United States, China",Nominated for 1 BAFTA Award17 wins & 48 nominations total,"[{'Source': 'Internet Movie Database', 'Value': '7.2/10'}, {'Source': 'Rotten Tomatoes', 'Value': '94%'}, {'Source': 'Metacritic', 'Value': '77/100'}]",77,7.2,"303,249",25 Oct 2016,"$486,295,561"
Star Wars: Episode I - The Phantom Menace,1027083462,1999,Star Wars: Episode I - The Phantom Menace,1999,PG,19 May 1999,136 min,"Action, Adventure, Fantasy",George Lucas,George Lucas,"Ewan McGregor, Liam Neeson, Natalie Portman","Two Jedi escape a hostile blockade to find allies and come across a young boy who may bring balance to the Force, but the long dormant Sith resurface to claim their original glory.","English, Sanskrit",United States,Nominated for 3 Oscars. 28 wins & 71 nominations total,"[{'Source': 'Internet Movie Database', 'Value': '6.5/10'}, {'Source': 'Rotten Tomatoes', 'Value': '52%'}, {'Source': 'Metacritic', 'Value': '51/100'}]",51,6.5,"856,434",10 Apr 2015,"$474,544,677"
Zootopia,1025521689,2016,Zootopia,2016,PG,04 Mar 2016,108 min,"Animation, Action, Adventure","Byron Howard, Rich Moore, Jared Bush","Byron Howard, Rich Moore, Jared Bush","Ginnifer Goodwin, Jason Bateman, Idris Elba","In a city of anthropomorphic animals, a rookie bunny cop and a cynical con artist fox must work together to uncover a conspiracy.",English,United States,Won 1 Oscar. 49 wins & 75 nominations total,"[{'Source': 'Internet Movie Database', 'Value': '8.0/10'}, {'Source': 'Rotten Tomatoes', 'Value': '98%'}, {'Source': 'Metacritic', 'Value': '78/100'}]",78,8.0,"546,300",07 Jun 2016,"$341,268,248"
Alice in Wonderland,1025468216,2010,Alice in Wonderland,2010,PG,05 Mar 2010,108 min,"Adventure, Family, Fantasy",Tim Burton,"Linda Woolverton, Lewis Carroll","Mia Wasikowska, Johnny Depp, Helena Bonham Carter","Nineteen-year-old Alice returns to the magical world from her childhood adventure, where she reunites with her old friends and learns of her true destiny: to end the Red Queen's reign of terror.","English, Russian, Ukrainian","United States, Italy, Canada, Japan, United Kingdom",Won 2 Oscars. 35 wins & 63 nominations total,"[{'Source': 'Internet Movie Database', 'Value': '6.4/10'}, {'Source': 'Rotten Tomatoes', 'Value': '51%'}, {'Source': 'Metacritic', 'Value': '53/100'}]",53,6.4,"439,808",23 Nov 2015,"$334,191,110"
Harry Potter and the Sorcerer's Stone,1024465951,2001,Harry Potter and the Sorcerer's Stone,2001,PG,16 Nov 2001,152 min,"Adventure, Family, Fantasy",Chris Columbus,"J.K. Rowling, Steve Kloves","Daniel Radcliffe, Rupert Grint, Emma Watson","An orphaned boy enrolls in a school of wizardry, where he learns the truth about himself, his family and the terrible evil that haunts the magical world.","English, Latin","United Kingdom, United States",Nominated for 3 Oscars. 20 wins & 74 nominations total,"[{'Source': 'Internet Movie Database', 'Value': '7.6/10'}, {'Source': 'Rotten Tomatoes', 'Value': '81%'}, {'Source': 'Metacritic', 'Value': '65/100'}]",65,7.6,"856,031",16 Dec 2012,"$318,886,962"
The Hobbit: An Unexpected Journey,1017106749,2012,The Hobbit: An Unexpected Journey,2012,PG-13,14 Dec 2012,169 min,"Adventure, Fantasy",Peter Jackson,"Fran Walsh, Philippa Boyens, Peter Jackson","Martin Freeman, Ian McKellen, Richard Armitage","A reluctant Hobbit, Bilbo Baggins, sets out to the Lonely Mountain with a spirited group of dwarves to reclaim their mountain home, and the gold within it from the dragon Smaug.",English,"New Zealand, United States",Nominated for 3 Oscars. 11 wins & 76 nominations total,"[{'Source': 'Internet Movie Database', 'Value': '7.8/10'}, {'Source': 'Rotten Tomatoes', 'Value': '64%'}, {'Source': 'Metacritic', 'Value': '58/100'}]",58,7.8,"872,015",11 Dec 2015,"$303,030,651"
The Dark Knight,1008486720,2008,The Dark Knight,2008,PG-13,18 Jul 2008,152 min,"Action, Crime, Drama",Christopher Nolan,"Jonathan Nolan, Christopher Nolan, David S. Goyer","Christian Bale, Heath Ledger, Aaron Eckhart","When the menace known as the Joker wreaks havoc and chaos on the people of Gotham, Batman must accept one of the greatest psychological and physical tests of his ability to fight injustice.","English, Mandarin","United States, United Kingdom",Won 2 Oscars. 163 wins & 164 nominations total,"[{'Source': 'Internet Movie Database', 'Value': '9.0/10'}, {'Source': 'Rotten Tomatoes', 'Value': '94%'}, {'Source': 'Metacritic', 'Value': '84/100'}]",84,9.0,"2,869,224",14 Jun 2010,"$534,987,076"
Harry Potter and the Order of the Phoenix,1003122577,2007,Harry Potter and the Order of the Phoenix,2007,PG-13,11 Jul 2007,138 min,"Action, Adventure, Family",David Yates,"Michael Goldenberg, J.K. Rowling","Daniel Radcliffe, Emma Watson, Rupert Grint","With their warning about Lord Voldemort's return scoffed at, Harry and Dumbledore are targeted by the Wizard authorities as an authoritarian bureaucrat slowly seizes power at Hogwarts.","English, Latin","United Kingdom, United States",Nominated for 2 BAFTA 17 wins & 50 nominations total,"[{'Source': 'Internet Movie Database', 'Value': '7.5/10'}, {'Source': 'Rotten Tomatoes', 'Value': '78%'}, {'Source': 'Metacritic', 'Value': '71/100'}]",71,7.5,"633,252",15 Dec 2009,"$292,382,727"
Jurassic World Dominion,1001978080,2022,Jurassic World Dominion,2022,PG-13,10 Jun 2022,147 min,"Action, Adventure, Sci-Fi",Colin Trevorrow,"Emily Carmichael, Colin Trevorrow, Derek Connolly","Chris Pratt, Bryce Dallas Howard, Laura Dern","Four years after the destruction of Isla Nublar, Biosyn operatives attempt to track down Maisie Lockwood, while Dr Ellie Sattler investigates a genetically engineered swarm of giant insects.","English, Maltese, French","United States, China",1 win & 25 nominations,"[{'Source': 'Internet Movie Database', 'Value': '5.6/10'}, {'Source': 'Rotten Tomatoes', 'Value': '29%'}, {'Source': 'Metacritic', 'Value': '38/100'}]",38,5.6,"204,544",02 Sep 2022,"$376,851,080"
Jumanji: Welcome to the Jungle,995340026,2017,Jumanji: Welcome to the Jungle,2017,PG-13,20 Dec 2017,119 min,"Action, Adventure, Comedy",Jake Kasdan,"Chris McKenna, Erik Sommers, Scott Rosenberg","Dwayne Johnson, Karen Gillan, Kevin Hart","Four teenagers are sucked into a magical video game, and the only way they can escape is to work together to finish the game.",English,"United States, Australia, Canada, Mexico, India, United Kingdom",5 wins & 15 nominations,"[{'Source': 'Internet Movie Database', 'Value': '6.9/10'}, {'Source': 'Rotten Tomatoes', 'Value': '76%'}, {'Source': 'Metacritic', 'Value': '58/100'}]",58,6.9,"433,038",03 Mar 2018,"$404,540,171"
Oppenheimer,971612566,2023,Oppenheimer,2023,R,21 Jul 2023,180 min,"Biography, Drama, History",Christopher Nolan,"Christopher Nolan, Kai Bird, Martin Sherwin","Cillian Murphy, Emily Blunt, Matt Damon",The story of American scientist J. Robert Oppenheimer and his role in the development of the atomic bomb.,"English, German, Italian","United States, United Kingdom",Won 7 Oscars. 344 wins & 358 nominations total,"[{'Source': 'Internet Movie Database', 'Value': '8.3/10'}, {'Source': 'Rotten Tomatoes', 'Value': '93%'}, {'Source': 'Metacritic', 'Value': '88/100'}]",88,8.3,"716,104",21 Nov 2023,"$329,862,540"
Despicable Me 2,970766005,2013,Despicable Me 2,2013,PG,03 Jul 2013,98 min,"Animation, Adventure, Comedy","Pierre Coffin, Chris Renaud","Cinco Paul, Ken Daurio","Steve Carell, Kristen Wiig, Benjamin Bratt","When Gru, the world's most super-bad turned super-dad has been recruited by a team of officials to stop lethal muscle and a host of Gru's own, he has to fight back with new gadgetry, cars, and more minion madness.","Ukrainian, English","United States, France, Japan",Nominated for 2 Oscars. 12 wins & 66 nominations total,"[{'Source': 'Internet Movie Database', 'Value': '7.3/10'}, {'Source': 'Rotten Tomatoes', 'Value': '75%'}, {'Source': 'Metacritic', 'Value': '62/100'}]",62,7.3,"425,864",01 Oct 2015,"$368,065,385"
The Lion King,968750694,1994,The Lion King,1994,G,24 Jun 1994,88 min,"Animation, Adventure, Drama","Roger Allers, Rob Minkoff","Irene Mecchi, Jonathan Roberts, Linda Woolverton","Matthew Broderick, Jeremy Irons, James Earl Jones","Lion prince Simba and his father are targeted by his bitter uncle, who wants to ascend the throne himself.","English, Swahili, Xhosa, Zulu",United States,Won 2 Oscars. 43 wins & 35 nominations total,"[{'Source': 'Internet Movie Database', 'Value': '8.5/10'}, {'Source': 'Rotten Tomatoes', 'Value': '92%'}, {'Source': 'Metacritic', 'Value': '88/100'}]",88,8.5,"1,135,709",15 Aug 2017,"$422,783,777"
The Jungle Book,967724775,2016,The Jungle Book,2016,PG,15 Apr 2016,106 min,"Animation, Action, Adventure",Jon Favreau,"Justin Marks, Rudyard Kipling","Neel Sethi, Bill Murray, Ben Kingsley","After a threat from the tiger Shere Khan forces him to flee the jungle, a man-cub named Mowgli embarks on a journey of self discovery with the help of panther Bagheera and free-spirited bear Baloo.",English,"United Kingdom, United States, New Zealand, France, Canada, India",Won 1 Oscar. 33 wins & 56 nominations total,"[{'Source': 'Internet Movie Database', 'Value': '7.4/10'}, {'Source': 'Rotten Tomatoes', 'Value': '94%'}, {'Source': 'Metacritic', 'Value': '77/100'}]",77,7.4,"290,928",23 Aug 2016,"$364,001,123"
The Hobbit: The Battle of the Five Armies,962253946,2014,The Hobbit: The Battle of the Five Armies,2014,PG-13,17 Dec 2014,144 min,"Adventure, Fantasy",Peter Jackson,"Fran Walsh, Philippa Boyens, Peter Jackson","Ian McKellen, Martin Freeman, Richard Armitage",Bilbo and company are forced to engage in a war against an array of combatants and keep the Lonely Mountain from falling into the hands of a rising darkness.,English,"New Zealand, United States",Nominated for 1 Oscar. 8 wins & 56 nominations total,"[{'Source': 'Internet Movie Database', 'Value': '7.4/10'}, {'Source': 'Rotten Tomatoes', 'Value': '59%'}, {'Source': 'Metacritic', 'Value': '59/100'}]",59,7.4,"568,745",03 Mar 2015,"$255,138,261"
Pirates of the Caribbean: At World's End,961691209,2007,Pirates of the Caribbean: At World's End,2007,PG-13,25 May 2007,169 min,"Action, Adventure, Fantasy",Gore Verbinski,"Ted Elliott, Terry Rossio, Stuart Beattie","Johnny Depp, Orlando Bloom, Keira Knightley","Captain Barbossa, Will Turner and Elizabeth Swann must sail off the edge of the map, navigate treachery and betrayal, find Jack Sparrow, and make their final alliances for one last decisive battle.",English,United States,Nominated for 2 Oscars. 23 wins & 51 nominations total,"[{'Source': 'Internet Movie Database', 'Value': '7.1/10'}, {'Source': 'Rotten Tomatoes', 'Value': '44%'}, {'Source': 'Metacritic', 'Value': '50/100'}]",50,7.1,"691,869",01 Jan 2014,"$309,420,425"
Harry Potter and the Deathly Hallows: Part 1,960898367,2010,Harry Potter and the Deathly Hallows: Part 1,2010,PG-13,19 Nov 2010,146 min,"Adventure, Family, Fantasy",David Yates,"Steve Kloves, J.K. Rowling","Daniel Radcliffe, Emma Watson, Rupert Grint","As Harry, Ron and Hermione race against time and evil to destroy the Horcruxes, they uncover the existence of the three most powerful objects in the wizarding world: the Deathly Hallows.","English, Latin","United Kingdom, United States",Nominated for 2 Oscars. 15 wins & 55 nominations total,"[{'Source': 'Internet Movie Database', 'Value': '7.7/10'}, {'Source': 'Rotten Tomatoes', 'Value': '77%'}, {'Source': 'Metacritic', 'Value': '65/100'}]",65,7.7,"598,476",19 Jul 2013,"$296,374,621"
The Hobbit: The Desolation of Smaug,959079095,2013,The Hobbit: The Desolation of Smaug,2013,PG-13,13 Dec 2013,161 min,"Adventure, Drama, Fantasy",Peter Jackson,"Fran Walsh, Philippa Boyens, Peter Jackson","Ian McKellen, Martin Freeman, Richard Armitage","The dwarves, along with Bilbo Baggins and Gandalf the Grey, continue their quest to reclaim Erebor, their homeland, from Smaug. Bilbo Baggins is in possession of a mysterious and magical ring.",English,"New Zealand, United States",Nominated for 3 Oscars. 19 wins & 90 nominations total,"[{'Source': 'Internet Movie Database', 'Value': '7.8/10'}, {'Source': 'Rotten Tomatoes', 'Value': '75%'}, {'Source': 'Metacritic', 'Value': '66/100'}]",66,7.8,"703,627",25 Sep 2014,"$258,387,334"
Doctor Strange in the Multiverse of Madness,955775804,2022,Doctor Strange in the Multiverse of Madness,2022,PG-13,06 May 2022,126 min,"Action, Adventure, Fantasy",Sam Raimi,"Michael Waldron, Stan Lee, Steve Ditko","Benedict Cumberbatch, Elizabeth Olsen, Chiwetel Ejiofor","Doctor Strange teams up with a mysterious teenage girl who can travel across multiverses, to battle other-universe versions of himself which threaten to wipe out the multiverse. They seek help from the Scarlet Witch, Wong and others.","English, Spanish, Chinese",United States,10 wins & 28 nominations,"[{'Source': 'Internet Movie Database', 'Value': '6.9/10'}, {'Source': 'Rotten Tomatoes', 'Value': '73%'}, {'Source': 'Metacritic', 'Value': '60/100'}]",60,6.9,"477,632",22 Jun 2022,"$411,331,607"
The Lord of the Rings: The Two Towers,948945489,2002,The Lord of the Rings: The Two Towers,2002,PG-13,18 Dec 2002,179 min,"Action, Adventure, Drama",Peter Jackson,"J.R.R. Tolkien, Fran Walsh, Philippa Boyens","Elijah Wood, Ian McKellen, Viggo Mortensen","While Frodo and Sam edge closer to Mordor with the help of the shifty Gollum, the divided fellowship makes a stand against Sauron's new ally, Saruman, and his hordes of Isengard.","English, Sindarin, Old English","New Zealand, United States",Won 2 Oscars. 132 wins & 138 nominations total,"[{'Source': 'Internet Movie Database', 'Value': '8.8/10'}, {'Source': 'Rotten Tomatoes', 'Value': '95%'}, {'Source': 'Metacritic', 'Value': '87/100'}]",87,8.8,"1,782,905",28 Jun 2011,"$342,952,511"
Finding Nemo,941637960,2003,Finding Nemo,2003,G,30 May 2003,100 min,"Animation, Adventure, Comedy","Andrew Stanton, Lee Unkrich","Andrew Stanton, Bob Peterson, David Reynolds","Albert Brooks, Ellen DeGeneres, Alexander Gould","After his son is captured in the Great Barrier Reef and taken to Sydney, a timid clownfish sets out on a journey to bring him home.","English, Japanese, Russian","United States, Japan",Won 1 Oscar. 49 wins & 63 nominations total,"[{'Source': 'Internet Movie Database', 'Value': '8.2/10'}, {'Source': 'Rotten Tomatoes', 'Value': '99%'}, {'Source': 'Metacritic', 'Value': '90/100'}]",90,8.2,"1,111,671",01 Jan 2014,"$380,843,261"
Minions: The Rise of Gru,940203765,2022,Minions: The Rise of Gru,2022,PG,01 Jul 2022,87 min,"Animation, Adventure, Comedy","Kyle Balda, Brad Ableson, Jonathan del Val","Matthew Fogel, Brian Lynch","Steve Carell, Pierre Coffin, Alan Arkin",The untold story of one twelve-year-old's dream to become the world's greatest supervillain.,"English, Vietnamese, Russian","United States, France",1 win & 17 nominations,"[{'Source': 'Internet Movie Database', 'Value': '6.5/10'}, {'Source': 'Rotten Tomatoes', 'Value': '70%'}, {'Source': 'Metacritic', 'Value': '56/100'}]",56,6.5,"84,842",23 Sep 2022,"$370,270,765"
Harry Potter and the Half-Blood Prince,934866317,2009,Harry Potter and the Half-Blood Prince,2009,PG,15 Jul 2009,153 min,"Action, Adventure, Family",David Yates,"Steve Kloves, J.K. Rowling","Daniel Radcliffe, Emma Watson, Rupert Grint","As Harry Potter begins his sixth year at Hogwarts, he discovers an old book marked as ""the property of the Half-Blood Prince"" and begins to learn more about Lord Voldemort's dark past.","English, Latin","United Kingdom, United States",Nominated for 1 Oscar. 9 wins & 39 nominations total,"[{'Source': 'Internet Movie Database', 'Value': '7.6/10'}, {'Source': 'Rotten Tomatoes', 'Value': '84%'}, {'Source': 'Metacritic', 'Value': '78/100'}]",78,7.6,"595,560",01 Jun 2011,"$302,334,374"
Shrek 2,932130052,2004,Shrek 2,2004,PG,19 May 2004,93 min,"Animation, Adventure, Comedy","Andrew Adamson, Kelly Asbury, Conrad Vernon","William Steig, Andrew Adamson, Joe Stillman","Mike Myers, Eddie Murphy, Cameron Diaz","Shrek and Fiona travel to the Kingdom of Far Far Away, where Fiona's parents are King and Queen, to celebrate their marriage. When they arrive, they find they are not as welcome as they thought they would be.",English,United States,Nominated for 2 Oscars. 18 wins & 52 nominations total,"[{'Source': 'Internet Movie Database', 'Value': '7.3/10'}, {'Source': 'Rotten Tomatoes', 'Value': '89%'}, {'Source': 'Metacritic', 'Value': '75/100'}]",75,7.3,"504,646",25 Nov 2015,"$444,457,007"
Bohemian Rhapsody,910813521,2018,Bohemian Rhapsody,2018,PG-13,02 Nov 2018,134 min,"Biography, Drama, Music",Bryan Singer,"Anthony McCarten, Peter Morgan","Rami Malek, Lucy Boynton, Gwilym Lee","The story of the legendary British rock band Queen and lead singer Freddie Mercury, leading up to their famous performance at Live Aid (1985).","English, British Sign ","United Kingdom, United States",Won 4 Oscars. 49 wins & 81 nominations total,"[{'Source': 'Internet Movie Database', 'Value': '7.9/10'}, {'Source': 'Rotten Tomatoes', 'Value': '60%'}, {'Source': 'Metacritic', 'Value': '49/100'}]",49,7.9,"590,892",22 Jan 2019,"$216,668,042"
The Battle at Lake Changjin,902548476,2021,The Battle at Lake Changjin,2021,Not Rated,30 Sep 2021,176 min,"Action, Drama, History","Kaige Chen, Dante Lam, Hark Tsui","Xiaolong Lan, Jianxin Huang","Jing Wu, Jackson Yee, Yihong Duan","In the fierce battlefield in the midst of the harsh weather conditions, Wu Qian Li and Wu Wan Li, two brothers soldier including the brave Chinese soldiers must fight together and find a way to cope with the invasion of US forces.","Mandarin, English",China,33 wins & 37 nominations,"[{'Source': 'Internet Movie Database', 'Value': '5.5/10'}, {'Source': 'Rotten Tomatoes', 'Value': '36%'}]",N/A,5.5,"4,063",N/A,"$342,411"
Harry Potter and the Goblet of Fire,897468399,2005,Harry Potter and the Goblet of Fire,2005,PG-13,18 Nov 2005,157 min,"Adventure, Family, Fantasy",Mike Newell,"Steve Kloves, J.K. Rowling","Daniel Radcliffe, Emma Watson, Rupert Grint","Harry Potter finds himself competing in a hazardous tournament between rival schools of magic, but he is distracted by recurring nightmares.","English, French, Latin","United Kingdom, United States",Nominated for 1 Oscar. 13 wins & 48 nominations total,"[{'Source': 'Internet Movie Database', 'Value': '7.7/10'}, {'Source': 'Rotten Tomatoes', 'Value': '88%'}, {'Source': 'Metacritic', 'Value': '81/100'}]",81,7.7,"677,173",01 Jan 2008,"$290,469,928"
Spider-Man 3,895480059,2007,Spider-Man 3,2007,PG-13,04 May 2007,139 min,"Action, Adventure, Sci-Fi",Sam Raimi,"Sam Raimi, Ivan Raimi, Alvin Sargent","Tobey Maguire, Kirsten Dunst, Topher Grace","A strange black entity from another world bonds with Peter Parker and causes inner turmoil as he contends with new villains, temptations, and revenge.","English, French",United States,Nominated for 1 BAFTA Award4 wins & 44 nominations total,"[{'Source': 'Internet Movie Database', 'Value': '6.3/10'}, {'Source': 'Rotten Tomatoes', 'Value': '63%'}, {'Source': 'Metacritic', 'Value': '59/100'}]",59,6.3,"636,696",16 Apr 2012,"$336,530,303"
The Secret Life of Pets,894567999,2016,The Secret Life of Pets,2016,PG,08 Jul 2016,86 min,"Animation, Adventure, Comedy",Chris Renaud,"Cinco Paul, Ken Daurio, Brian Lynch","Louis C.K., Eric Stonestreet, Kevin Hart","The quiet life of a terrier named Max is upended when his owner takes in Duke, a stray whom Max instantly dislikes.",English,"United States, Japan",4 wins & 15 nominations,"[{'Source': 'Internet Movie Database', 'Value': '6.5/10'}, {'Source': 'Rotten Tomatoes', 'Value': '70%'}, {'Source': 'Metacritic', 'Value': '61/100'}]",61,6.5,"217,370",22 Nov 2016,"$368,623,860"
Ice Age: Dawn of the Dinosaurs,886686817,2009,Ice Age: Dawn of the Dinosaurs,2009,PG,01 Jul 2009,94 min,"Animation, Adventure, Comedy","Carlos Saldanha, Michael Thurmeier","Michael Berg, Peter Ackerman, Mike Reiss","Ray Romano, John Leguizamo, Denis Leary","When Sid's attempt to adopt three dinosaur eggs gets him abducted by their real mother to an underground lost world, his friends attempt to rescue him.",English,"United States, United Kingdom, Canada",3 wins & 13 nominations,"[{'Source': 'Internet Movie Database', 'Value': '6.9/10'}, {'Source': 'Rotten Tomatoes', 'Value': '46%'}, {'Source': 'Metacritic', 'Value': '50/100'}]",50,6.9,"264,077",04 Aug 2014,"$196,573,705"
