Title,Lifetime Gross,Year,Title,Year,Rated,Released,Runtime,Genre,Director,Writer,Actors,Plot,Language,Country,Awards,Ratings,Metascore,imdbRating,imdbVotes,DVD,BoxOffice
Mission: Impossible - Rogue Nation,682716636,2015,Mission: Impossible - Rogue Nation,2015,PG-13,31 Jul 2015,131 min,"Action, Adventure, Thriller",Christopher McQuarrie,"Bruce Geller, Christopher McQuarrie, Drew Pearce","Tom Cruise, Rebecca Ferguson, Jeremy Renner",Ethan and his team take on their most impossible mission yet when they have to eradicate an international rogue organization as highly skilled as they are and committed to destroying the IMF.,"English, Swedish, German, Russian","United States, China, United Kingdom, Austria, Morocco",6 wins & 26 nominations,"[{'Source': 'Internet Movie Database', 'Value': '7.4/10'}, {'Source': 'Rotten Tomatoes', 'Value': '94%'}, {'Source': 'Metacritic', 'Value': '75/100'}]",75,7.4,"409,790",01 Jun 2016,"$195,042,377"
Forrest Gump,678226465,1994,Forrest Gump,1994,PG-13,06 Jul 1994,142 min,"Drama, Romance",Robert Zemeckis,"Winston Groom, Eric Roth","Tom Hanks, Robin Wright, Gary Sinise","The history of the United States from the 1950s to the '70s unfolds from the perspective of an Alabama man with an IQ of 75, who yearns to be reunited with his childhood sweetheart.",English,United States,Won 6 Oscars. 51 wins & 74 nominations total,"[{'Source': 'Internet Movie Database', 'Value': '8.8/10'}, {'Source': 'Rotten Tomatoes', 'Value': '76%'}, {'Source': 'Metacritic', 'Value': '82/100'}]",82,8.8,"2,256,886",01 Aug 2013,"$330,455,270"
Doctor Strange,677796833,2016,Doctor Strange,2016,PG-13,04 Nov 2016,115 min,"Action, Adventure, Fantasy",Scott Derrickson,"Jon Spaihts, Scott Derrickson, C. Robert Cargill","Benedict Cumberbatch, Chiwetel Ejiofor, Rachel McAdams","While on a journey of physical and spiritual healing, a brilliant neurosurgeon is drawn into the world of the mystic arts.",English,United States,Nominated for 1 Oscar. 21 wins & 68 nominations total,"[{'Source': 'Internet Movie Database', 'Value': '7.5/10'}, {'Source': 'Rotten Tomatoes', 'Value': '89%'}, {'Source': 'Metacritic', 'Value': '72/100'}]",72,7.5,"804,452",14 Feb 2017,"$232,641,920"
The Sixth Sense,672806432,1999,The Sixth Sense,1999,PG-13,06 Aug 1999,107 min,"Drama, Mystery, Thriller",M. Night Shyamalan,M. Night Shyamalan,"Bruce Willis, Haley Joel Osment, Toni Collette","Malcolm Crowe, a child psychologist, starts treating a young boy, Cole, who encounters dead people and convinces him to help them. In turn, Cole helps Malcolm reconcile with his estranged wife.","English, Latin, Spanish",United States,Nominated for 6 Oscars. 37 wins & 56 nominations total,"[{'Source': 'Internet Movie Database', 'Value': '8.2/10'}, {'Source': 'Rotten Tomatoes', 'Value': '86%'}, {'Source': 'Metacritic', 'Value': '64/100'}]",64,8.2,"1,047,165",08 Jul 2016,"$293,506,292"
Man of Steel,670145518,2013,Man of Steel,2013,PG-13,14 Jun 2013,143 min,"Action, Adventure, Sci-Fi",Zack Snyder,"David S. Goyer, Christopher Nolan, Jerry Siegel","Henry Cavill, Amy Adams, Michael Shannon",An alien child is evacuated from his dying world and sent to Earth to live among humans. His peace is threatened when other survivors of his home planet invade Earth.,English,"United States, United Kingdom",Nominated for 1 BAFTA Award7 wins & 46 nominations total,"[{'Source': 'Internet Movie Database', 'Value': '7.1/10'}, {'Source': 'Rotten Tomatoes', 'Value': '56%'}, {'Source': 'Metacritic', 'Value': '55/100'}]",55,7.1,"809,805",08 Dec 2015,"$291,045,518"
Ice Age: The Meltdown,667094506,2006,Ice Age: The Meltdown,2006,PG,31 Mar 2006,91 min,"Animation, Adventure, Comedy",Carlos Saldanha,"Peter Gaulke, Gerry Swallow, Jim Hecht","Ray Romano, John Leguizamo, Denis Leary","Manny, Sid and Diego discover that the ice age is coming to an end, and join everybody for a journey to higher ground. On the trip, they discover that Manny is not in fact the last of the woolly mammoths.",English,"United States, United Kingdom",8 wins & 16 nominations,"[{'Source': 'Internet Movie Database', 'Value': '6.8/10'}, {'Source': 'Rotten Tomatoes', 'Value': '56%'}, {'Source': 'Metacritic', 'Value': '59/100'}]",59,6.8,"296,507",01 Jun 2015,"$195,330,621"
Kung Fu Panda 2,665692281,2011,Kung Fu Panda 2,2011,PG,26 May 2011,90 min,"Animation, Action, Adventure",Jennifer Yuh Nelson,"Jonathan Aibel, Glenn Berger, Ethan Reiff","Jack Black, Angelina Jolie, Jackie Chan","Po and his friends fight to stop a peacock villain from conquering China with a deadly new weapon, but first the Dragon Warrior must come to terms with his past.",English,"United States, Canada",Nominated for 1 Oscar. 5 wins & 47 nominations total,"[{'Source': 'Internet Movie Database', 'Value': '7.3/10'}, {'Source': 'Rotten Tomatoes', 'Value': '81%'}, {'Source': 'Metacritic', 'Value': '67/100'}]",67,7.3,"320,394",25 Nov 2015,"$165,249,063"
The Hunger Games: Mockingjay - Part 2,661456867,2015,The Hunger Games: Mockingjay - Part 2,2015,PG-13,20 Nov 2015,137 min,"Action, Adventure, Sci-Fi",Francis Lawrence,"Peter Craig, Danny Strong, Suzanne Collins","Jennifer Lawrence, Josh Hutcherson, Liam Hemsworth",Katniss and a team of rebels from District 13 prepare for the final battle that will decide the fate of Panem.,English,"United States, Germany, Canada, France",15 wins & 34 nominations,"[{'Source': 'Internet Movie Database', 'Value': '6.5/10'}, {'Source': 'Rotten Tomatoes', 'Value': '69%'}, {'Source': 'Metacritic', 'Value': '65/100'}]",65,6.5,"371,894",08 Mar 2016,"$281,723,902"
Justice League,661326987,2017,Justice League,2017,PG-13,17 Nov 2017,120 min,"Action, Adventure, Fantasy",Zack Snyder,"Jerry Siegel, Joe Shuster, Chris Terrio","Ben Affleck, Gal Gadot, Jason Momoa","Fueled by his restored faith in humanity and inspired by Superman's selfless act, Bruce Wayne enlists the help of his new-found ally, Diana Prince, to face an even greater enemy.","English, Irish Gaelic, Russian, Icelandic","United States, Canada, United Kingdom",2 wins & 14 nominations,"[{'Source': 'Internet Movie Database', 'Value': '6.1/10'}, {'Source': 'Rotten Tomatoes', 'Value': '40%'}, {'Source': 'Metacritic', 'Value': '45/100'}]",45,6.1,"477,156",13 Feb 2018,"$229,024,295"
Big Hero 6,657870525,2014,Big Hero 6,2014,PG,07 Nov 2014,102 min,"Animation, Action, Adventure","Don Hall, Chris Williams","Jordan Roberts, Robert L. Baird, Daniel Gerson","Ryan Potter, Scott Adsit, Jamie Chung","A special bond develops between plus-sized inflatable robot Baymax and prodigy Hiro Hamada, who together team up with a group of friends to form a band of high-tech heroes.",English,United States,Won 1 Oscar. 17 wins & 58 nominations total,"[{'Source': 'Internet Movie Database', 'Value': '7.8/10'}, {'Source': 'Rotten Tomatoes', 'Value': '90%'}, {'Source': 'Metacritic', 'Value': '74/100'}]",74,7.8,"501,565",22 Nov 2015,"$222,527,828"
Fantastic Beasts: The Crimes of Grindelwald,655755901,2018,Fantastic Beasts: The Crimes of Grindelwald,2018,PG-13,16 Nov 2018,134 min,"Adventure, Family, Fantasy",David Yates,J.K. Rowling,"Eddie Redmayne, Katherine Waterston, Dan Fogler","Gellert Grindelwald plans to raise an army of wizards to rule over non-magical beings. In response, Newt Scamander's former professor, Albus Dumbledore, seeks his help to stop him.","English, French","United Kingdom, United States",Nominated for 2 BAFTA 3 wins & 23 nominations total,"[{'Source': 'Internet Movie Database', 'Value': '6.5/10'}, {'Source': 'Rotten Tomatoes', 'Value': '36%'}, {'Source': 'Metacritic', 'Value': '52/100'}]",52,6.5,"308,637",14 Feb 2019,"$159,555,901"
Pirates of the Caribbean: The Curse of the Black Pearl,654264546,2003,Pirates of the Caribbean: The Curse of the Black Pearl,2003,PG-13,09 Jul 2003,143 min,"Action, Adventure, Fantasy",Gore Verbinski,"Ted Elliott, Terry Rossio, Stuart Beattie","Johnny Depp, Geoffrey Rush, Orlando Bloom","Blacksmith Will Turner teams up with eccentric pirate ""Captain"" Jack Sparrow to save his love, the governor's daughter, from Jack's former pirate allies, who are now undead.",English,United States,Nominated for 5 Oscars. 38 wins & 104 nominations total,"[{'Source': 'Internet Movie Database', 'Value': '8.1/10'}, {'Source': 'Rotten Tomatoes', 'Value': '80%'}, {'Source': 'Metacritic', 'Value': '63/100'}]",63,8.1,"1,204,608",23 Nov 2015,"$305,413,918"
Men in Black³,654213485,2012,Men in Black³,2012,PG-13,25 May 2012,106 min,"Action, Adventure, Comedy",Barry Sonnenfeld,"Etan Cohen, Lowell Cunningham","Will Smith, Tommy Lee Jones, Josh Brolin",Agent J travels in time to M.I.B.'s early days in 1969 to stop an alien from assassinating his friend Agent K and changing history.,"Ukrainian, English","United States, United Arab Emirates",1 win & 13 nominations,"[{'Source': 'Internet Movie Database', 'Value': '6.8/10'}, {'Source': 'Rotten Tomatoes', 'Value': '67%'}, {'Source': 'Metacritic', 'Value': '58/100'}]",58,6.8,"387,006",07 Sep 2014,"$179,020,854"
Star Wars: Episode II - Attack of the Clones,653780724,2002,Star Wars: Episode II - Attack of the Clones,2002,PG,16 May 2002,142 min,"Action, Adventure, Fantasy",George Lucas,"George Lucas, Jonathan Hales","Hayden Christensen, Natalie Portman, Ewan McGregor","Ten years after initially meeting, Anakin Skywalker shares a forbidden romance with Padmé Amidala, while Obi-Wan Kenobi discovers a secret clone army crafted for the Jedi.",English,United States,Nominated for 1 Oscar. 21 wins & 71 nominations total,"[{'Source': 'Internet Movie Database', 'Value': '6.6/10'}, {'Source': 'Rotten Tomatoes', 'Value': '65%'}, {'Source': 'Metacritic', 'Value': '54/100'}]",54,6.6,"758,917",10 Apr 2015,"$310,676,740"
Thor: The Dark World,644783140,2013,Thor: The Dark World,2013,PG-13,08 Nov 2013,112 min,"Action, Adventure, Fantasy",Alan Taylor,"Christopher L. Yost, Christopher Markus, Stephen McFeely","Chris Hemsworth, Natalie Portman, Tom Hiddleston","When the Dark Elves attempt to plunge the universe into darkness, Thor must embark on a perilous and personal journey that will reunite him with doctor Jane Foster.",English,United States,4 wins & 21 nominations,"[{'Source': 'Internet Movie Database', 'Value': '6.8/10'}, {'Source': 'Rotten Tomatoes', 'Value': '67%'}, {'Source': 'Metacritic', 'Value': '54/100'}]",54,6.8,"725,052",06 Sep 2015,"$206,362,140"
Sing,634338409,2016,Sing,2016,PG,21 Dec 2016,108 min,"Animation, Comedy, Family","Garth Jennings, Christophe Lourdelet",Garth Jennings,"Matthew McConaughey, Reese Witherspoon, Seth MacFarlane","In a city of humanoid animals, a hustling theater impresario's attempt to save his theater with a singing competition becomes grander than he anticipates even as its finalists find that their lives will never be the same.","English, Japanese","Japan, United States, France",3 wins & 25 nominations,"[{'Source': 'Internet Movie Database', 'Value': '7.1/10'}, {'Source': 'Rotten Tomatoes', 'Value': '71%'}, {'Source': 'Metacritic', 'Value': '59/100'}]",59,7.1,"189,964",08 Mar 2017,"$270,578,425"
Wonka,632302312,2023,Wonka,2023,PG,15 Dec 2023,116 min,"Adventure, Comedy, Family",Paul King,"Roald Dahl, Paul King, Simon Farnaby","Timothée Chalamet, Gustave Die, Murray McArthur","With dreams of opening a shop in a city renowned for its chocolate, a young and poor Willy Wonka discovers that the industry is run by a cartel of greedy chocolatiers.",English,"United States, United Kingdom, Canada",Nominated for 1 BAFTA Award1 win & 35 nominations total,"[{'Source': 'Internet Movie Database', 'Value': '7.0/10'}, {'Source': 'Rotten Tomatoes', 'Value': '82%'}]",N/A,7.0,"137,043",30 Jan 2024,"$218,402,312"
Kung Fu Panda,632091832,2008,Kung Fu Panda,2008,PG,06 Jun 2008,92 min,"Animation, Action, Adventure","Mark Osborne, John Stevenson","Jonathan Aibel, Glenn Berger, Ethan Reiff","Jack Black, Ian McShane, Angelina Jolie","To everyone's surprise, including his own, Po, an overweight, clumsy panda, is chosen as protector of the Valley of Peace. His suitability will soon be tested as the valley's arch-enemy is on his way.",English,United States,Nominated for 1 Oscar. 15 wins & 39 nominations total,"[{'Source': 'Internet Movie Database', 'Value': '7.6/10'}, {'Source': 'Rotten Tomatoes', 'Value': '87%'}, {'Source': 'Metacritic', 'Value': '74/100'}]",74,7.6,"522,660",25 Nov 2015,"$215,771,591"
The Incredibles,631686750,2004,The Incredibles,2004,PG,05 Nov 2004,115 min,"Animation, Action, Adventure",Brad Bird,Brad Bird,"Craig T. Nelson, Samuel L. Jackson, Holly Hunter","While trying to lead a quiet suburban life, a family of undercover superheroes are forced into action to save the world.","English, French, German, Italian, Portuguese, Russian","United States, Japan",Won 2 Oscars. 69 wins & 56 nominations total,"[{'Source': 'Internet Movie Database', 'Value': '8.0/10'}, {'Source': 'Metacritic', 'Value': '90/100'}]",90,8.0,"803,770",29 Mar 2005,"$261,441,092"
The Martian,630620818,2015,The Martian,2015,PG-13,02 Oct 2015,144 min,"Adventure, Drama, Sci-Fi",Ridley Scott,"Drew Goddard, Andy Weir","Matt Damon, Jessica Chastain, Kristen Wiig","An astronaut becomes stranded on Mars after his team assume him dead, and must rely on his ingenuity to find a way to signal to Earth that he is alive and can survive until a potential rescue.","English, Mandarin","United States, United Kingdom, Hungary, Jordan",Nominated for 7 Oscars. 40 wins & 199 nominations total,"[{'Source': 'Internet Movie Database', 'Value': '8.0/10'}, {'Source': 'Rotten Tomatoes', 'Value': '91%'}, {'Source': 'Metacritic', 'Value': '80/100'}]",80,8.0,"924,576",22 Dec 2015,"$228,433,663"
Hancock,629443428,2008,Hancock,2008,R,02 Jul 2008,92 min,"Action, Comedy, Drama",Peter Berg,"Vy Vincent Ngo, Vince Gilligan","Will Smith, Charlize Theron, Jason Bateman",Hancock is a superhero whose ill-considered behavior regularly causes damage in the millions. He changes when the person he saves helps him improve his public image.,"English, Japanese, Vietnamese",United States,4 wins & 14 nominations,"[{'Source': 'Internet Movie Database', 'Value': '6.4/10'}, {'Source': 'Rotten Tomatoes', 'Value': '42%'}, {'Source': 'Metacritic', 'Value': '49/100'}]",49,6.4,"511,222",01 Oct 2011,"$227,946,274"
Water Gate Bridge,626571697,2022,Water Gate Bridge,2022,N/A,01 Feb 2022,153 min,"Action, Drama, History","Hark Tsui, Kaige Chen, Dante Lam","Jianxin Huang, Xiaolong Lan, Xiaojiang Quji","Jing Wu, Jackson Yee, Michael Koltes","Sequel to ""The Battle at Lake Changjin"". Follows the Chinese People's Volunteers (CPV) soldiers on a new task, and now their battlefield is a crucial bridge on the retreat route of American troops.","Mandarin, English",China,10 wins & 17 nominations,"[{'Source': 'Internet Movie Database', 'Value': '5.6/10'}]",N/A,5.6,"1,370",N/A,"$117,294"
Fast Five,626140012,2011,Fast Five,2011,PG-13,29 Apr 2011,130 min,"Action, Crime, Thriller",Justin Lin,"Chris Morgan, Gary Scott Thompson","Vin Diesel, Paul Walker, Dwayne Johnson",Dominic Toretto and his crew of street racers plan a massive heist to buy their freedom while in the sights of a powerful Brazilian drug lord and a dangerous federal agent.,"English, Portuguese, Spanish, Italian, French","United States, Japan",9 wins & 21 nominations,"[{'Source': 'Internet Movie Database', 'Value': '7.3/10'}, {'Source': 'Rotten Tomatoes', 'Value': '78%'}, {'Source': 'Metacritic', 'Value': '66/100'}]",66,7.3,"405,665",01 Jan 2015,"$209,837,675"
Iron Man 2,623933331,2010,Iron Man 2,2010,PG-13,07 May 2010,124 min,"Action, Sci-Fi",Jon Favreau,"Justin Theroux, Stan Lee, Don Heck","Robert Downey Jr., Mickey Rourke, Gwyneth Paltrow","With the world now aware of his identity as Iron Man, Tony Stark must contend with both his declining health and a vengeful mad man with ties to his father's legacy.","English, French, Russian",United States,Nominated for 1 Oscar. 7 wins & 45 nominations total,"[{'Source': 'Internet Movie Database', 'Value': '6.9/10'}, {'Source': 'Rotten Tomatoes', 'Value': '72%'}, {'Source': 'Metacritic', 'Value': '57/100'}]",57,6.9,"868,515",03 May 2013,"$312,433,331"
Ratatouille,623728318,2007,Ratatouille,2007,G,27 Jun 2007,111 min,"Animation, Adventure, Comedy","Brad Bird, Jan Pinkava","Brad Bird, Jan Pinkava, Jim Capobianco","Brad Garrett, Lou Romano, Patton Oswalt",A rat who can cook makes an unusual alliance with a young kitchen worker at a famous Paris restaurant.,"English, French",United States,Won 1 Oscar. 68 wins & 42 nominations total,"[{'Source': 'Internet Movie Database', 'Value': '8.1/10'}, {'Source': 'Rotten Tomatoes', 'Value': '96%'}, {'Source': 'Metacritic', 'Value': '96/100'}]",96,8.1,"824,348",01 Jan 2014,"$206,445,654"
Ant-Man and the Wasp,622674139,2018,Ant-Man and the Wasp,2018,PG-13,06 Jul 2018,118 min,"Action, Adventure, Comedy",Peyton Reed,"Chris McKenna, Erik Sommers, Paul Rudd","Paul Rudd, Evangeline Lilly, Michael Peña","As Scott Lang balances being both a superhero and a father, Hope van Dyne and Dr. Hank Pym present an urgent new mission that finds the Ant-Man fighting alongside The Wasp to uncover secrets from their past.","English, Spanish, French","United States, Canada",2 wins & 21 nominations,"[{'Source': 'Internet Movie Database', 'Value': '7.0/10'}, {'Source': 'Rotten Tomatoes', 'Value': '87%'}, {'Source': 'Metacritic', 'Value': '70/100'}]",70,7.0,"449,824",02 Oct 2018,"$216,648,740"
How to Train Your Dragon 2,621537519,2014,How to Train Your Dragon 2,2014,PG,13 Jun 2014,102 min,"Animation, Action, Adventure",Dean DeBlois,"Dean DeBlois, Cressida Cowell","Jay Baruchel, Cate Blanchett, Gerard Butler","When Hiccup and Toothless discover an ice cave that is home to hundreds of new wild dragons and the mysterious Dragon Rider, the two friends find themselves at the center of a battle to protect the peace.",English,"United States, India",Nominated for 1 Oscar. 15 wins & 61 nominations total,"[{'Source': 'Internet Movie Database', 'Value': '7.8/10'}, {'Source': 'Rotten Tomatoes', 'Value': '92%'}, {'Source': 'Metacritic', 'Value': '77/100'}]",77,7.8,"361,576",25 Nov 2015,"$177,002,924"
Logan,619180476,2017,Logan,2017,R,03 Mar 2017,137 min,"Action, Drama, Sci-Fi",James Mangold,"James Mangold, Scott Frank, Michael Green","Hugh Jackman, Patrick Stewart, Dafne Keen","In a future where mutants are nearly extinct, an elderly and weary Logan leads a quiet life. But when Laura, a mutant child pursued by scientists, comes to him for help, he must get her to safety.","English, Spanish",United States,Nominated for 1 Oscar. 28 wins & 82 nominations total,"[{'Source': 'Internet Movie Database', 'Value': '8.1/10'}, {'Source': 'Rotten Tomatoes', 'Value': '93%'}, {'Source': 'Metacritic', 'Value': '77/100'}]",77,8.1,"825,834",16 May 2017,"$226,277,068"
The Lost World: Jurassic Park,618638999,1997,The Lost World: Jurassic Park,1997,PG-13,23 May 1997,129 min,"Action, Adventure, Sci-Fi",Steven Spielberg,"Michael Crichton, David Koepp","Jeff Goldblum, Julianne Moore, Pete Postlethwaite","A research team is sent to the Jurassic Park Site B island to study the dinosaurs there, while an InGen team approaches with another agenda.","English, Spanish",United States,Nominated for 1 Oscar. 4 wins & 28 nominations total,"[{'Source': 'Internet Movie Database', 'Value': '6.5/10'}, {'Source': 'Rotten Tomatoes', 'Value': '53%'}, {'Source': 'Metacritic', 'Value': '59/100'}]",59,6.5,"444,047",22 Jul 2015,"$229,086,679"
Casino Royale,616505162,2006,Casino Royale,2006,PG-13,17 Nov 2006,144 min,"Action, Adventure, Thriller",Martin Campbell,"Neal Purvis, Robert Wade, Paul Haggis","Daniel Craig, Eva Green, Judi Dench","After earning 00 status and a licence to kill, secret agent James Bond sets out on his first mission as 007. Bond must defeat a private banker funding terrorists in a high-stakes game of poker at Casino Royale, Montenegro.","English, Serbian, German, Italian, French","United States, United Kingdom, Czech Republic, Germany, Bahamas",Won 1 BAFTA Award28 wins & 44 nominations total,"[{'Source': 'Internet Movie Database', 'Value': '8.0/10'}, {'Source': 'Rotten Tomatoes', 'Value': '94%'}, {'Source': 'Metacritic', 'Value': '80/100'}]",80,8.0,"694,342",30 Nov 2016,"$167,445,960"
The Passion of the Christ,612060372,2004,The Passion of the Christ,2004,R,25 Feb 2004,127 min,Drama,Mel Gibson,"Benedict Fitzgerald, Mel Gibson","Jim Caviezel, Monica Bellucci, Maia Morgenstern","Depicts the final twelve hours in the life of Jesus of Nazareth, on the day of his crucifixion in Jerusalem.","Aramaic, Latin, Hebrew, English",United States,Nominated for 3 Oscars. 30 wins & 24 nominations total,"[{'Source': 'Internet Movie Database', 'Value': '7.2/10'}, {'Source': 'Rotten Tomatoes', 'Value': '49%'}, {'Source': 'Metacritic', 'Value': '47/100'}]",47,7.2,"251,033",25 Nov 2015,"$370,782,930"
Life of Pi,609016565,2012,Life of Pi,2012,PG,21 Nov 2012,127 min,"Adventure, Drama, Fantasy",Ang Lee,"Yann Martel, David Magee","Suraj Sharma, Irrfan Khan, Adil Hussain","A young man who survives a disaster at sea is hurtled into an epic journey of adventure and discovery. While cast away, he forms an unexpected connection with another survivor: a fearsome Bengal tiger.","English, Hindi, Japanese, French","United States, Taiwan, United Kingdom, Canada, India, France",Won 4 Oscars. 81 wins & 134 nominations total,"[{'Source': 'Internet Movie Database', 'Value': '7.9/10'}, {'Source': 'Rotten Tomatoes', 'Value': '86%'}, {'Source': 'Metacritic', 'Value': '79/100'}]",79,7.9,"664,239",31 Jul 2014,"$124,987,023"
Ready Player One,607874422,2018,Ready Player One,2018,PG-13,29 Mar 2018,140 min,"Action, Adventure, Sci-Fi",Steven Spielberg,"Zak Penn, Ernest Cline","Tye Sheridan, Olivia Cooke, Ben Mendelsohn","When the creator of a virtual reality called the OASIS dies, he makes a posthumous challenge to all OASIS users to find his Easter Egg, which will give the finder his fortune and control of his world.",English,"United States, India, Singapore, Canada, United Kingdom, Japan, Australia",Nominated for 1 Oscar. 10 wins & 56 nominations total,"[{'Source': 'Internet Movie Database', 'Value': '7.4/10'}, {'Source': 'Rotten Tomatoes', 'Value': '72%'}, {'Source': 'Metacritic', 'Value': '64/100'}]",64,7.4,"485,906",05 Apr 2018,"$137,715,350"
Transformers: The Last Knight,605425157,2017,Transformers: The Last Knight,2017,PG-13,21 Jun 2017,154 min,"Action, Adventure, Sci-Fi",Michael Bay,"Art Marcum, Matt Holloway, Ken Nolan","Mark Wahlberg, Anthony Hopkins, Josh Duhamel","A deadly threat from Earth's history reappears and a hunt for a lost artifact takes place between Autobots and Decepticons, while Optimus Prime encounters his creator in space.",English,"United States, China, Canada",3 wins & 20 nominations,"[{'Source': 'Internet Movie Database', 'Value': '5.2/10'}, {'Source': 'Rotten Tomatoes', 'Value': '16%'}, {'Source': 'Metacritic', 'Value': '27/100'}]",27,5.2,"168,751",10 Jul 2017,"$130,168,683"
Madagascar: Escape 2 Africa,603900354,2008,Madagascar: Escape 2 Africa,2008,PG,07 Nov 2008,89 min,"Animation, Adventure, Comedy","Eric Darnell, Tom McGrath","Etan Cohen, Eric Darnell, Tom McGrath","Ben Stiller, Chris Rock, David Schwimmer","The Madagascar animals fly back to New York City, but crash-land on an African nature reserve in Kenya, where they meet others of their own kind, and Alex especially discovers his royal heritage as prince of a lion pride.",English,United States,4 wins & 11 nominations,"[{'Source': 'Internet Movie Database', 'Value': '6.6/10'}, {'Source': 'Rotten Tomatoes', 'Value': '64%'}, {'Source': 'Metacritic', 'Value': '61/100'}]",61,6.6,"247,449",25 Nov 2015,"$180,010,950"
War of the Worlds,603873504,2005,War of the Worlds,2005,PG-13,29 Jun 2005,116 min,"Action, Adventure, Sci-Fi",Steven Spielberg,"Josh Friedman, David Koepp, H.G. Wells","Tom Cruise, Dakota Fanning, Tim Robbins",An alien invasion threatens the future of humanity. The catastrophic nightmare is depicted through the eyes of one American family fighting for survival.,"English, Czech, Hungarian","United States, Canada, Japan",Nominated for 3 Oscars. 16 wins & 49 nominations total,"[{'Source': 'Internet Movie Database', 'Value': '6.5/10'}, {'Source': 'Rotten Tomatoes', 'Value': '76%'}, {'Source': 'Metacritic', 'Value': '73/100'}]",73,6.5,"473,686",14 Nov 2014,"$234,280,354"
Tangled,592472813,2010,Tangled,2010,PG,24 Nov 2010,100 min,"Animation, Adventure, Comedy","Nathan Greno, Byron Howard","Dan Fogelman, Jacob Grimm, Wilhelm Grimm","Mandy Moore, Zachary Levi, Donna Murphy","The magically long-haired Rapunzel has spent her entire life in a tower, but now that a runaway thief has stumbled upon her, she is about to discover the world for the first time, and who she really is.","English, German","United States, Japan",Nominated for 1 Oscar. 10 wins & 42 nominations total,"[{'Source': 'Internet Movie Database', 'Value': '7.7/10'}, {'Source': 'Rotten Tomatoes', 'Value': '89%'}, {'Source': 'Metacritic', 'Value': '71/100'}]",71,7.7,"491,212",01 Jan 2014,"$200,821,936"
Quantum of Solace,589593688,2008,Quantum of Solace,2008,PG-13,14 Nov 2008,106 min,"Action, Adventure, Mystery",Marc Forster,"Paul Haggis, Neal Purvis, Robert Wade","Daniel Craig, Olga Kurylenko, Mathieu Amalric",James Bond descends into mystery as he tries to stop a mysterious organisation from eliminating a country's most valuable resource.,"English, Spanish, Italian, French, Swiss German, German","United States, United Kingdom",Nominated for 2 BAFTA 4 wins & 32 nominations total,"[{'Source': 'Internet Movie Database', 'Value': '6.5/10'}, {'Source': 'Rotten Tomatoes', 'Value': '64%'}, {'Source': 'Metacritic', 'Value': '58/100'}]",58,6.5,"469,599",15 Jan 2017,"$168,368,427"
