Title,Lifetime Gross,Year,Title,Year,Rated,Released,Runtime,Genre,Director,Writer,Actors,Plot,Language,Country,Awards,Ratings,Metascore,imdbRating,imdbVotes,DVD,BoxOffice
Avatar,2923706026,2009,Avatar,2009,PG-13,18 Dec 2009,162 min,"Action, Adventure, Fantasy",James Cameron,James Cameron,"Sam Worthington, Zoe Saldana, Sigourney Weaver",A paraplegic Marine dispatched to the moon Pandora on a unique mission becomes torn between following his orders and protecting the world he feels is his home.,"English, Spanish",United States,Won 3 Oscars. 91 wins & 131 nominations total,"[{'Source': 'Internet Movie Database', 'Value': '7.9/10'}, {'Source': 'Rotten Tomatoes', 'Value': '82%'}, {'Source': 'Metacritic', 'Value': '83/100'}]",83,7.9,"1,384,939",10 Feb 2016,"$785,221,649"
Avengers: Endgame,2799439100,2019,Avengers: Endgame,2019,PG-13,26 Apr 2019,181 min,"Action, Adventure, Drama","Anthony Russo, Joe Russo","Christopher Markus, Stephen McFeely, Stan Lee","Robert Downey Jr., Chris Evans, Mark Ruffalo","After the devastating events of Avengers: Infinity War (2018), the universe is in ruins. With the help of remaining allies, the Avengers assemble once more in order to reverse Thanos' actions and restore balance to the universe.","English, Japanese, Xhosa, German",United States,Nominated for 1 Oscar. 70 wins & 133 nominations total,"[{'Source': 'Internet Movie Database', 'Value': '8.4/10'}, {'Source': 'Rotten Tomatoes', 'Value': '94%'}, {'Source': 'Metacritic', 'Value': '78/100'}]",78,8.4,"1,264,820",30 Jul 2019,"$858,373,000"
Avatar: The Way of Water,2320250281,2022,Avatar: The Way of Water,2022,PG-13,16 Dec 2022,192 min,"Action, Adventure, Fantasy",James Cameron,"James Cameron, Rick Jaffa, Amanda Silver","Sam Worthington, Zoe Saldana, Sigourney Weaver","Jake Sully lives with his newfound family formed on the extrasolar moon Pandora. Once a familiar threat returns to finish what was previously started, Jake must work with Neytiri and the army of the Na'vi race to protect their home.",English,United States,Won 1 Oscar. 75 wins & 150 nominations total,"[{'Source': 'Internet Movie Database', 'Value': '7.6/10'}, {'Source': 'Rotten Tomatoes', 'Value': '76%'}, {'Source': 'Metacritic', 'Value': '67/100'}]",67,7.6,"488,471",28 Mar 2023,"$684,075,767"
Titanic,2264750694,1997,Titanic,1997,PG-13,19 Dec 1997,194 min,"Drama, Romance",James Cameron,James Cameron,"Leonardo DiCaprio, Kate Winslet, Billy Zane","A seventeen-year-old aristocrat falls in love with a kind but poor artist aboard the luxurious, ill-fated R.M.S. Titanic.","English, Swedish, Italian, French","United States, Mexico",Won 11 Oscars. 126 wins & 83 nominations total,"[{'Source': 'Internet Movie Database', 'Value': '7.9/10'}, {'Source': 'Rotten Tomatoes', 'Value': '88%'}, {'Source': 'Metacritic', 'Value': '75/100'}]",75,7.9,"1,280,439",01 Jun 2014,"$674,292,608"
Star Wars: Episode VII - The Force Awakens,2071310218,2015,Star Wars: Episode VII - The Force Awakens,2015,PG-13,18 Dec 2015,138 min,"Action, Adventure, Sci-Fi",J.J. Abrams,"Lawrence Kasdan, J.J. Abrams, Michael Arndt","Daisy Ridley, John Boyega, Oscar Isaac","As a new threat to the galaxy rises, Rey, a desert scavenger, and Finn, an ex-stormtrooper, must join Han Solo and Chewbacca to search for the one hope of restoring peace.",English,United States,Nominated for 5 Oscars. 64 wins & 140 nominations total,"[{'Source': 'Internet Movie Database', 'Value': '7.8/10'}, {'Source': 'Rotten Tomatoes', 'Value': '93%'}, {'Source': 'Metacritic', 'Value': '80/100'}]",80,7.8,"973,458",01 Apr 2016,"$936,662,225"
Avengers: Infinity War,2052415039,2018,Avengers: Infinity War,2018,PG-13,27 Apr 2018,149 min,"Action, Adventure, Sci-Fi","Anthony Russo, Joe Russo","Christopher Markus, Stephen McFeely, Stan Lee","Robert Downey Jr., Chris Hemsworth, Mark Ruffalo",The Avengers and their allies must be willing to sacrifice all in an attempt to defeat the powerful Thanos before his blitz of devastation and ruin puts an end to the universe.,English,"United States, Norway",Nominated for 1 Oscar. 46 wins & 80 nominations total,"[{'Source': 'Internet Movie Database', 'Value': '8.4/10'}, {'Source': 'Rotten Tomatoes', 'Value': '85%'}, {'Source': 'Metacritic', 'Value': '68/100'}]",68,8.4,"1,203,157",31 Jul 2018,"$678,815,482"
Spider-Man: No Way Home,1921847111,2021,Spider-Man: No Way Home,2021,PG-13,17 Dec 2021,148 min,"Action, Adventure, Fantasy",Jon Watts,"Chris McKenna, Erik Sommers, Stan Lee","Tom Holland, Zendaya, Benedict Cumberbatch","With Spider-Man's identity now revealed, Peter asks Doctor Strange for help. When a spell goes wrong, dangerous foes from other worlds start to appear, forcing Peter to discover what it truly means to be Spider-Man.",English,United States,Nominated for 1 Oscar. 35 wins & 71 nominations total,"[{'Source': 'Internet Movie Database', 'Value': '8.2/10'}, {'Source': 'Rotten Tomatoes', 'Value': '93%'}, {'Source': 'Metacritic', 'Value': '71/100'}]",71,8.2,"870,223",15 Mar 2022,"$814,115,070"
Jurassic World,1671537444,2015,Jurassic World,2015,PG-13,12 Jun 2015,124 min,"Action, Adventure, Sci-Fi",Colin Trevorrow,"Rick Jaffa, Amanda Silver, Colin Trevorrow","Chris Pratt, Bryce Dallas Howard, Ty Simpkins","A new theme park, built on the original site of Jurassic Park, creates a genetically modified hybrid dinosaur, the Indominus Rex, which escapes containment and goes on a killing spree.",English,"United States, Canada",15 wins & 58 nominations,"[{'Source': 'Internet Movie Database', 'Value': '6.9/10'}, {'Source': 'Rotten Tomatoes', 'Value': '71%'}, {'Source': 'Metacritic', 'Value': '59/100'}]",59,6.9,"677,212",06 Sep 2016,"$653,406,625"
The Lion King,1663079059,2019,The Lion King,1994,G,24 Jun 1994,88 min,"Animation, Adventure, Drama","Roger Allers, Rob Minkoff","Irene Mecchi, Jonathan Roberts, Linda Woolverton","Matthew Broderick, Jeremy Irons, James Earl Jones","Lion prince Simba and his father are targeted by his bitter uncle, who wants to ascend the throne himself.","English, Swahili, Xhosa, Zulu",United States,Won 2 Oscars. 43 wins & 35 nominations total,"[{'Source': 'Internet Movie Database', 'Value': '8.5/10'}, {'Source': 'Rotten Tomatoes', 'Value': '92%'}, {'Source': 'Metacritic', 'Value': '88/100'}]",88,8.5,"1,135,709",15 Aug 2017,"$422,783,777"
The Avengers,1520538536,2012,The Avengers,2012,PG-13,04 May 2012,143 min,"Action, Sci-Fi",Joss Whedon,"Joss Whedon, Zak Penn","Robert Downey Jr., Chris Evans, Scarlett Johansson",Earth's mightiest heroes must come together and learn to fight as a team if they are going to stop the mischievous Loki and his alien army from enslaving humanity.,"English, Russian",United States,Nominated for 1 Oscar. 39 wins & 81 nominations total,"[{'Source': 'Internet Movie Database', 'Value': '8.0/10'}, {'Source': 'Rotten Tomatoes', 'Value': '91%'}, {'Source': 'Metacritic', 'Value': '69/100'}]",69,8.0,"1,457,886",22 Jun 2014,"$623,357,910"
Furious 7,1515342457,2015,Furious 7,2015,PG-13,03 Apr 2015,137 min,"Action, Crime, Thriller",James Wan,"Chris Morgan, Gary Scott Thompson","Vin Diesel, Paul Walker, Dwayne Johnson",Deckard Shaw seeks revenge against Dominic Toretto and his family for his comatose brother.,"English, Thai, Arabic, Spanish","United States, China, Japan, Canada, United Arab Emirates",37 wins & 37 nominations,"[{'Source': 'Internet Movie Database', 'Value': '7.1/10'}, {'Source': 'Rotten Tomatoes', 'Value': '81%'}, {'Source': 'Metacritic', 'Value': '67/100'}]",67,7.1,"414,389",01 Mar 2016,"$353,007,020"
Top Gun: Maverick,1495696292,2022,Top Gun: Maverick,2022,PG-13,27 May 2022,130 min,"Action, Drama",Joseph Kosinski,"Jim Cash, Jack Epps Jr., Peter Craig","Tom Cruise, Jennifer Connelly, Miles Teller","After thirty years, Maverick is still pushing the envelope as a top naval aviator, but must confront ghosts of his past when he leads TOP GUN's elite graduates on a mission that demands the ultimate sacrifice from those chosen to ...",English,United States,Won 1 Oscar. 107 wins & 234 nominations total,"[{'Source': 'Internet Movie Database', 'Value': '8.2/10'}, {'Source': 'Rotten Tomatoes', 'Value': '96%'}, {'Source': 'Metacritic', 'Value': '78/100'}]",78,8.2,"695,684",22 Aug 2022,"$718,732,821"
Frozen II,1453683476,2019,Frozen II,2019,PG,22 Nov 2019,103 min,"Animation, Adventure, Comedy","Chris Buck, Jennifer Lee","Jennifer Lee, Hans Christian Andersen, Chris Buck","Kristen Bell, Idina Menzel, Josh Gad","Anna, Elsa, Kristoff, Olaf and Sven leave Arendelle to travel to an ancient, autumn-bound forest of an enchanted land. They set out to find the origin of Elsa's powers in order to save their kingdom.",English,"Japan, United States",Nominated for 1 Oscar. 19 wins & 92 nominations total,"[{'Source': 'Internet Movie Database', 'Value': '6.8/10'}, {'Source': 'Rotten Tomatoes', 'Value': '77%'}, {'Source': 'Metacritic', 'Value': '64/100'}]",64,6.8,"194,602",22 Nov 2019,"$477,373,578"
Barbie,1445638421,2023,Barbie,2023,PG-13,21 Jul 2023,114 min,"Adventure, Comedy, Fantasy",Greta Gerwig,"Greta Gerwig, Noah Baumbach","Margot Robbie, Ryan Gosling, Issa Rae","Barbie and Ken are having the time of their lives in the colorful and seemingly perfect world of Barbie Land. However, when they get a chance to go to the real world, they soon discover the joys and perils of living among humans.","English, Spanish","United States, United Kingdom",Won 1 Oscar. 193 wins & 420 nominations total,"[{'Source': 'Internet Movie Database', 'Value': '6.8/10'}, {'Source': 'Rotten Tomatoes', 'Value': '88%'}, {'Source': 'Metacritic', 'Value': '80/100'}]",80,6.8,"535,851",12 Sep 2023,"$636,238,421"
Avengers: Age of Ultron,1405018048,2015,Avengers: Age of Ultron,2015,PG-13,01 May 2015,141 min,"Action, Adventure, Sci-Fi",Joss Whedon,"Joss Whedon, Stan Lee, Jack Kirby","Robert Downey Jr., Chris Evans, Mark Ruffalo","When Tony Stark and Bruce Banner try to jump-start a dormant peacekeeping program called Ultron, things go horribly wrong and it's up to Earth's mightiest heroes to stop the villainous Ultron from enacting his terrible plan.","English, Korean",United States,8 wins & 52 nominations,"[{'Source': 'Internet Movie Database', 'Value': '7.3/10'}, {'Source': 'Rotten Tomatoes', 'Value': '76%'}, {'Source': 'Metacritic', 'Value': '66/100'}]",66,7.3,"917,528",08 Sep 2015,"$459,005,868"
Frozen,1397045694,2013,Frozen,2013,PG,27 Nov 2013,102 min,"Animation, Adventure, Comedy","Chris Buck, Jennifer Lee","Jennifer Lee, Hans Christian Andersen, Chris Buck","Kristen Bell, Idina Menzel, Jonathan Groff","Fearless optimist Anna teams up with rugged mountain man Kristoff and his loyal reindeer Sven in an epic journey to find Anna's sister Elsa, whose icy powers have trapped the kingdom of Arendelle in eternal winter.",English,United States,Won 2 Oscars. 83 wins & 60 nominations total,"[{'Source': 'Internet Movie Database', 'Value': '7.4/10'}, {'Source': 'Rotten Tomatoes', 'Value': '90%'}, {'Source': 'Metacritic', 'Value': '75/100'}]",75,7.4,"663,791",25 Feb 2014,"$400,953,009"
The Super Mario Bros. Movie,1362029918,2023,The Super Mario Bros. Movie,2023,PG,05 Apr 2023,92 min,"Animation, Adventure, Comedy","Aaron Horvath, Michael Jelenic, Pierre Leduc",Matthew Fogel,"Chris Pratt, Anya Taylor-Joy, Charlie Day","A plumber named Mario travels through an underground labyrinth with his brother Luigi, trying to save a captured princess.",English,"United States, Japan",1 win & 43 nominations,"[{'Source': 'Internet Movie Database', 'Value': '7.0/10'}, {'Source': 'Rotten Tomatoes', 'Value': '59%'}, {'Source': 'Metacritic', 'Value': '46/100'}]",46,7.0,"233,409",16 May 2023,"$574,934,330"
Harry Potter and the Deathly Hallows: Part 2,1356962211,2011,Harry Potter and the Deathly Hallows: Part 2,2011,PG-13,15 Jul 2011,130 min,"Adventure, Family, Fantasy",David Yates,"Steve Kloves, J.K. Rowling","Daniel Radcliffe, Emma Watson, Rupert Grint","Harry, Ron, and Hermione search for Voldemort's remaining Horcruxes in their effort to destroy the Dark Lord as the final battle rages on at Hogwarts.","English, Latin","United Kingdom, United States",Nominated for 3 Oscars. 48 wins & 95 nominations total,"[{'Source': 'Internet Movie Database', 'Value': '8.1/10'}, {'Source': 'Rotten Tomatoes', 'Value': '96%'}, {'Source': 'Metacritic', 'Value': '85/100'}]",85,8.1,"947,886",20 Jul 2013,"$381,447,587"
Black Panther,1349926083,2018,Black Panther,2018,PG-13,16 Feb 2018,134 min,"Action, Adventure, Sci-Fi",Ryan Coogler,"Ryan Coogler, Joe Robert Cole, Stan Lee","Chadwick Boseman, Michael B. Jordan, Lupita Nyong'o","T'Challa, heir to the hidden but advanced kingdom of Wakanda, must step forward to lead his people into a new future and must confront a challenger from his country's past.","English, Swahili, Nama, Xhosa, Korean",United States,Won 3 Oscars. 123 wins & 289 nominations total,"[{'Source': 'Internet Movie Database', 'Value': '7.3/10'}, {'Source': 'Rotten Tomatoes', 'Value': '96%'}, {'Source': 'Metacritic', 'Value': '88/100'}]",88,7.3,"837,583",02 May 2018,"$700,426,566"
Star Wars: Episode VIII - The Last Jedi,1334407706,2017,Star Wars: Episode VIII - The Last Jedi,2017,PG-13,15 Dec 2017,152 min,"Action, Adventure, Fantasy",Rian Johnson,"Rian Johnson, George Lucas","Daisy Ridley, John Boyega, Mark Hamill","Rey develops her abilities with the help of Luke Skywalker, as the Resistance prepares for battle against the First Order.",English,United States,Nominated for 4 Oscars. 26 wins & 99 nominations total,"[{'Source': 'Internet Movie Database', 'Value': '6.9/10'}, {'Source': 'Rotten Tomatoes', 'Value': '91%'}, {'Source': 'Metacritic', 'Value': '84/100'}]",84,6.9,"671,953",11 Mar 2018,"$620,181,382"
Jurassic World: Fallen Kingdom,1310469037,2018,Jurassic World: Fallen Kingdom,2018,PG-13,22 Jun 2018,128 min,"Action, Adventure, Sci-Fi",J.A. Bayona,"Derek Connolly, Colin Trevorrow, Michael Crichton","Chris Pratt, Bryce Dallas Howard, Rafe Spall","When the island's dormant volcano begins roaring to life, Owen and Claire mount a campaign to rescue the remaining dinosaurs from this extinction-level event.","English, Russian","United States, China",4 wins & 26 nominations,"[{'Source': 'Internet Movie Database', 'Value': '6.1/10'}, {'Source': 'Rotten Tomatoes', 'Value': '46%'}, {'Source': 'Metacritic', 'Value': '51/100'}]",51,6.1,"343,657",31 Aug 2018,"$417,719,760"
Beauty and the Beast,1266115964,2017,Beauty and the Beast,1991,G,22 Nov 1991,84 min,"Animation, Family, Fantasy","Gary Trousdale, Kirk Wise","Linda Woolverton, Brenda Chapman, Chris Sanders","Paige O'Hara, Robby Benson, Jesse Corti",A prince cursed to spend his days as a hideous monster sets out to regain his humanity by earning a young woman's love.,"English, French","United States, Japan",Won 2 Oscars. 33 wins & 32 nominations total,"[{'Source': 'Internet Movie Database', 'Value': '8.0/10'}, {'Source': 'Rotten Tomatoes', 'Value': '93%'}, {'Source': 'Metacritic', 'Value': '95/100'}]",95,8.0,"479,443",06 Sep 2016,"$218,967,620"
Incredibles 2,1243225667,2018,Incredibles 2,2018,PG,15 Jun 2018,118 min,"Animation, Action, Adventure",Brad Bird,Brad Bird,"Craig T. Nelson, Holly Hunter, Sarah Vowell",The Incredibles family takes on a new mission which involves a change in family roles: Bob Parr (Mr. Incredible) must manage the house while his wife Helen (Elastigirl) goes out to save the world.,"English, Russian","United States, Japan",Nominated for 1 Oscar. 14 wins & 81 nominations total,"[{'Source': 'Internet Movie Database', 'Value': '7.5/10'}, {'Source': 'Rotten Tomatoes', 'Value': '93%'}, {'Source': 'Metacritic', 'Value': '80/100'}]",80,7.5,"329,595",23 Oct 2018,"$608,581,744"
The Fate of the Furious,1236009236,2017,The Fate of the Furious,2017,PG-13,14 Apr 2017,136 min,"Action, Crime, Thriller",F. Gary Gray,"Gary Scott Thompson, Chris Morgan","Vin Diesel, Jason Statham, Dwayne Johnson","When a mysterious woman seduces Dominic Toretto into the world of terrorism and a betrayal of those closest to him, the crew face trials that will test them as never before.","English, Russian, Spanish","China, Japan, United States",2 wins & 16 nominations,"[{'Source': 'Internet Movie Database', 'Value': '6.6/10'}, {'Source': 'Rotten Tomatoes', 'Value': '67%'}, {'Source': 'Metacritic', 'Value': '56/100'}]",56,6.6,"252,806",27 Jun 2017,"$226,008,385"
Iron Man 3,1215577205,2013,Iron Man 3,2013,PG-13,03 May 2013,130 min,"Action, Adventure, Sci-Fi",Shane Black,"Drew Pearce, Shane Black, Stan Lee","Robert Downey Jr., Guy Pearce, Gwyneth Paltrow","When Tony Stark's world is torn apart by a formidable terrorist called the Mandarin, he starts an odyssey of rebuilding and retribution.",English,United States,Nominated for 1 Oscar. 20 wins & 63 nominations total,"[{'Source': 'Internet Movie Database', 'Value': '7.1/10'}, {'Source': 'Rotten Tomatoes', 'Value': '79%'}, {'Source': 'Metacritic', 'Value': '62/100'}]",62,7.1,"898,052",08 Apr 2015,"$409,013,994"
Minions,1159457503,2015,Minions,2015,PG,10 Jul 2015,91 min,"Animation, Adventure, Comedy","Kyle Balda, Pierre Coffin",Brian Lynch,"Sandra Bullock, Jon Hamm, Michael Keaton","Minions Stuart, Kevin, and Bob are recruited by Scarlet Overkill, a supervillain who, alongside her inventor husband Herb, hatches a plot to take over the world.","English, Spanish, Italian","United States, Mexico, Japan, France",Nominated for 1 BAFTA Award4 wins & 29 nominations total,"[{'Source': 'Internet Movie Database', 'Value': '6.4/10'}, {'Source': 'Rotten Tomatoes', 'Value': '56%'}, {'Source': 'Metacritic', 'Value': '56/100'}]",56,6.4,"259,318",10 Aug 2016,"$336,045,770"
The Lord of the Rings: The Return of the King,1156600472,2003,The Lord of the Rings: The Return of the King,2003,PG-13,17 Dec 2003,201 min,"Action, Adventure, Drama",Peter Jackson,"J.R.R. Tolkien, Fran Walsh, Philippa Boyens","Elijah Wood, Viggo Mortensen, Ian McKellen",Gandalf and Aragorn lead the World of Men against Sauron's army to draw his gaze from Frodo and Sam as they approach Mount Doom with the One Ring.,"English, Quenya, Old English, Sindarin","New Zealand, United States",Won 11 Oscars. 215 wins & 124 nominations total,"[{'Source': 'Internet Movie Database', 'Value': '9.0/10'}, {'Source': 'Rotten Tomatoes', 'Value': '94%'}, {'Source': 'Metacritic', 'Value': '94/100'}]",94,9.0,"1,978,133",06 Apr 2010,"$379,427,292"
Captain America: Civil War,1155046416,2016,Captain America: Civil War,2016,PG-13,06 May 2016,147 min,"Action, Sci-Fi","Anthony Russo, Joe Russo","Christopher Markus, Stephen McFeely, Joe Simon","Chris Evans, Robert Downey Jr., Scarlett Johansson",Political involvement in the Avengers' affairs causes a rift between Captain America and Iron Man.,"English, German, Xhosa, Russian, Romanian","United States, Germany",16 wins & 73 nominations,"[{'Source': 'Internet Movie Database', 'Value': '7.8/10'}, {'Source': 'Rotten Tomatoes', 'Value': '91%'}, {'Source': 'Metacritic', 'Value': '75/100'}]",75,7.8,"845,914",02 Sep 2016,"$408,084,349"
Aquaman,1152028393,2018,Aquaman,2018,PG-13,21 Dec 2018,143 min,"Action, Adventure, Fantasy",James Wan,"David Leslie Johnson-McGoldrick, Will Beall, Geoff Johns","Jason Momoa, Amber Heard, Willem Dafoe","Arthur Curry, the human-born heir to the underwater kingdom of Atlantis, goes on a quest to prevent a war between the worlds of ocean and land.","English, Russian, Maori, Italian","United States, Australia",3 wins & 36 nominations,"[{'Source': 'Internet Movie Database', 'Value': '6.8/10'}, {'Source': 'Rotten Tomatoes', 'Value': '66%'}, {'Source': 'Metacritic', 'Value': '55/100'}]",55,6.8,"518,662",05 Mar 2019,"$335,104,314"
Skyfall,1142504419,2012,Skyfall,2012,PG-13,09 Nov 2012,143 min,"Action, Adventure, Thriller",Sam Mendes,"Neal Purvis, Robert Wade, John Logan","Daniel Craig, Javier Bardem, Naomie Harris","James Bond's loyalty to M is tested when her past comes back to haunt her. When MI6 comes under attack, 007 must track down and destroy the threat, no matter how personal the cost.","English, Turkish, Shanghainese, Portuguese, Japanese","United Kingdom, United States, Turkey",Won 2 Oscars. 69 wins & 125 nominations total,"[{'Source': 'Internet Movie Database', 'Value': '7.8/10'}, {'Source': 'Rotten Tomatoes', 'Value': '92%'}, {'Source': 'Metacritic', 'Value': '81/100'}]",81,7.8,"729,430",04 Feb 2017,"$304,360,277"
Spider-Man: Far from Home,1131927996,2019,Spider-Man: Far from Home,2019,PG-13,02 Jul 2019,129 min,"Action, Adventure, Comedy",Jon Watts,"Chris McKenna, Erik Sommers, Stan Lee","Tom Holland, Samuel L. Jackson, Jake Gyllenhaal","Following the events of Avengers: Endgame (2019), Spider-Man must step up to take on new threats in a world that has changed forever.","English, Italian, Czech","United States, Czech Republic, Australia, Canada, Italy",11 wins & 26 nominations,"[{'Source': 'Internet Movie Database', 'Value': '7.4/10'}, {'Source': 'Rotten Tomatoes', 'Value': '91%'}, {'Source': 'Metacritic', 'Value': '69/100'}]",69,7.4,"556,719",27 Aug 2019,"$390,532,085"
Captain Marvel,1131416446,2019,Captain Marvel,2019,PG-13,08 Mar 2019,123 min,"Action, Adventure, Sci-Fi","Anna Boden, Ryan Fleck","Anna Boden, Ryan Fleck, Geneva Robertson-Dworet","Brie Larson, Samuel L. Jackson, Ben Mendelsohn",Carol Danvers becomes one of the universe's most powerful heroes when Earth is caught in the middle of a galactic war between two alien races.,English,"United States, Australia",10 wins & 56 nominations,"[{'Source': 'Internet Movie Database', 'Value': '6.8/10'}, {'Source': 'Rotten Tomatoes', 'Value': '79%'}, {'Source': 'Metacritic', 'Value': '64/100'}]",64,6.8,"610,735",28 May 2019,"$426,829,839"
Transformers: Dark of the Moon,1123794079,2011,Transformers: Dark of the Moon,2011,PG-13,29 Jun 2011,154 min,"Action, Adventure, Sci-Fi",Michael Bay,Ehren Kruger,"Shia LaBeouf, Rosie Huntington-Whiteley, Tyrese Gibson","The Autobots learn of a Cybertronian spacecraft hidden on the moon, and race against the Decepticons to reach it and to learn its secrets.","English, Russian",United States,Nominated for 3 Oscars. 11 wins & 42 nominations total,"[{'Source': 'Internet Movie Database', 'Value': '6.2/10'}, {'Source': 'Rotten Tomatoes', 'Value': '35%'}, {'Source': 'Metacritic', 'Value': '42/100'}]",42,6.2,"431,275",06 Jun 2014,"$352,390,543"
Jurassic Park,1114456337,1993,Jurassic Park,1993,PG-13,11 Jun 1993,127 min,"Action, Adventure, Sci-Fi",Steven Spielberg,"Michael Crichton, David Koepp","Sam Neill, Laura Dern, Jeff Goldblum",A pragmatic paleontologist touring an almost complete theme park on an island in Central America is tasked with protecting a couple of kids after a power failure causes the park's cloned dinosaurs to run loose.,"English, Spanish",United States,Won 3 Oscars. 44 wins & 27 nominations total,"[{'Source': 'Internet Movie Database', 'Value': '8.2/10'}, {'Source': 'Rotten Tomatoes', 'Value': '92%'}, {'Source': 'Metacritic', 'Value': '68/100'}]",68,8.2,"1,060,897",18 May 2015,"$407,185,075"
Transformers: Age of Extinction,1104054072,2014,Transformers: Age of Extinction,2014,PG-13,27 Jun 2014,165 min,"Action, Adventure, Sci-Fi",Michael Bay,"Ehren Kruger, Shôji Kawamori, Kazutaka Miyatake","Mark Wahlberg, Nicola Peltz Beckham, Jack Reynor","When humanity allies with a bounty hunter in pursuit of Optimus Prime, the Autobots turn to a mechanic and his family for help.","English, Chinese","United States, China, Hong Kong",5 wins & 23 nominations,"[{'Source': 'Internet Movie Database', 'Value': '5.6/10'}, {'Source': 'Rotten Tomatoes', 'Value': '18%'}, {'Source': 'Metacritic', 'Value': '32/100'}]",32,5.6,"331,535",13 Jun 2016,"$245,439,076"
The Dark Knight Rises,1085289416,2012,The Dark Knight Rises,2012,PG-13,20 Jul 2012,164 min,"Action, Drama, Thriller",Christopher Nolan,"Jonathan Nolan, Christopher Nolan, David S. Goyer","Christian Bale, Tom Hardy, Anne Hathaway","Eight years after the Joker's reign of chaos, Batman is coerced out of exile with the assistance of the mysterious Selina Kyle in order to defend Gotham City from the vicious guerrilla terrorist Bane.","English, Arabic","United States, United Kingdom",Nominated for 1 BAFTA Award45 wins & 104 nominations total,"[{'Source': 'Internet Movie Database', 'Value': '8.4/10'}, {'Source': 'Rotten Tomatoes', 'Value': '87%'}, {'Source': 'Metacritic', 'Value': '78/100'}]",78,8.4,"1,824,185",07 Jan 2014,"$448,149,584"
Joker,1078958629,2019,Joker,2019,R,04 Oct 2019,122 min,"Crime, Drama, Thriller",Todd Phillips,"Todd Phillips, Scott Silver, Bob Kane","Joaquin Phoenix, Robert De Niro, Zazie Beetz","During the 1980s, a failed stand-up comedian is driven insane and turns to a life of crime and chaos in Gotham City while becoming an infamous psychopathic crime figure.","English, German","United States, Canada, Australia",Won 2 Oscars. 121 wins & 245 nominations total,"[{'Source': 'Internet Movie Database', 'Value': '8.4/10'}, {'Source': 'Rotten Tomatoes', 'Value': '69%'}, {'Source': 'Metacritic', 'Value': '59/100'}]",59,8.4,"1,477,104",03 Oct 2019,"$335,477,657"
Star Wars: Episode IX - The Rise of Skywalker,1077022372,2019,Star Wars: Episode IX - The Rise of Skywalker,2019,PG-13,20 Dec 2019,141 min,"Action, Adventure, Fantasy",J.J. Abrams,"Chris Terrio, J.J. Abrams, Derek Connolly","Daisy Ridley, John Boyega, Oscar Isaac","In the riveting conclusion of the landmark Skywalker saga, new legends will be born-and the final battle for freedom is yet to come.",English,United States,Nominated for 3 Oscars. 21 wins & 55 nominations total,"[{'Source': 'Internet Movie Database', 'Value': '6.4/10'}, {'Source': 'Rotten Tomatoes', 'Value': '51%'}, {'Source': 'Metacritic', 'Value': '53/100'}]",53,6.4,"490,416",20 Dec 2019,"$515,202,542"
